,genre_ids,id,overview,title,year
198,"[53, 28, 878]",121442,"It is 2020. Findings by environmental scientist Professor Thom Archer suggest that Halo, the corporate energy company drilling on the Greenland Glacier are causing it to melt. Archer's warnings are ignored, so he heads to the Arctic to find indisputable evidence. Upon arrival, he realizes humankind is under immediate threat, and races home to save his family. The glacier collapses, with devastating consequences. Astonishing weather patterns emerge and plunge the world's temperatures into steep decline.",Ice 2020,2011
199,"[18, 35, 10749]",49020,"15-year-old deep-thinking Welsh schoolboy, Oliver Tate struggles to initiate and maintain a relationship with Jordana, his devilish, dark-haired classmate at their Swansea high school. As his parents' marriage begins to fall apart, similar problems arise in his relationship with Jordana.",Submarine,2011
200,"[878, 28, 12]",24428,"When an unexpected enemy emerges and threatens global safety and security, Nick Fury, director of the international peacekeeping agency known as S.H.I.E.L.D., finds himself in need of a team to pull the world back from the brink of disaster. Spanning the globe, a daring recruitment effort begins!",The Avengers,2012
201,"[28, 80, 18, 53]",49026,"Following the death of District Attorney Harvey Dent, Batman assumes responsibility for Dent's crimes to protect the late attorney's reputation and is subsequently hunted by the Gotham City Police Department. Eight years later, Batman encounters the mysterious Selina Kyle and the villainous Bane, a new terrorist leader who overwhelms Gotham's finest. The Dark Knight resurfaces to protect a city that has branded him an enemy.",The Dark Knight Rises,2012
202,"[28, 12, 14]",1930,"Peter Parker is an outcast high schooler abandoned by his parents as a boy, leaving him to be raised by his Uncle Ben and Aunt May. Like most teenagers, Peter is trying to figure out who he is and how he got to be the person he is today. As Peter discovers a mysterious briefcase that belonged to his father, he begins a quest to understand his parents' disappearance – leading him directly to Oscorp and the lab of Dr. Curt Connors, his father's former partner. As Spider-Man is set on a collision course with Connors' alter ego, The Lizard, Peter will make life-altering choices to use his powers and shape his destiny to become a hero.",The Amazing Spider-Man,2012
203,"[28, 12, 53]",37724,"When Bond's latest assignment goes gravely wrong and agents around the world are exposed, MI6 is attacked forcing M to relocate the agency. These events cause her authority and position to be challenged by Gareth Mallory, the new Chairman of the Intelligence and Security Committee. With MI6 now compromised from both inside and out, M is left with one ally she can trust: Bond. 007 takes to the shadows - aided only by field agent, Eve - following a trail to the mysterious Silva, whose lethal and hidden motives have yet to reveal themselves.",Skyfall,2012
204,"[16, 35, 12, 10751]",57800,"Manny, Diego, and Sid embark upon another adventure after their continent is set adrift. Using an iceberg as a ship, they encounter sea creatures and battle pirates as they explore a new world.",Ice Age: Continental Drift,2012
205,"[16, 10751]",73723,"A 12-year-old boy searches for the one thing that will enable him to win the affection of the girl of his dreams. To find it he must discover the story of the Lorax, the grumpy yet charming creature who fights to protect his world.",The Lorax,2012
206,"[16, 12, 35, 10751, 28, 14]",62177,"Brave is set in the mystical Scottish Highlands, where Mérida is the princess of a kingdom ruled by King Fergus and Queen Elinor. An unruly daughter and an accomplished archer, Mérida one day defies a sacred custom of the land and inadvertently brings turmoil to the kingdom. In an attempt to set things right, Mérida seeks out an eccentric old Wise Woman and is granted an ill-fated wish. Also figuring into Mérida’s quest — and serving as comic relief — are the kingdom’s three lords: the enormous Lord MacGuffin, the surly Lord Macintosh, and the disagreeable Lord Dingwall.",Brave,2012
207,"[12, 14, 28]",49051,"Bilbo Baggins, a hobbit enjoying his quiet life, is swept into an epic quest by Gandalf the Grey and thirteen dwarves who seek to reclaim their mountain home from Smaug, the dragon.",The Hobbit: An Unexpected Journey,2012
208,"[12, 28, 878]",72545,"Sean Anderson partners with his mom's boyfriend on a mission to find his grandfather, who is thought to be missing on a mythical island.",Journey 2: The Mysterious Island,2012
209,"[16, 35, 10751, 14]",76492,"Welcome to Hotel Transylvania, Dracula's lavish five-stake resort, where monsters and their families can live it up and no humans are allowed. One special weekend, Dracula has invited all his best friends to celebrate his beloved daughter Mavis's 118th birthday. For Dracula catering to all of these legendary monsters is no problem but the party really starts when one ordinary guy stumbles into the hotel and changes everything!",Hotel Transylvania,2012
210,"[12, 35, 18, 10751, 14]",62764,"After she spends all her money, an evil enchantress queen schemes to marry a handsome, wealthy prince. There's just one problem - he's in love with a beautiful princess, Snow White. Now, joined by seven rebellious dwarves, Snow White launches an epic battle of good vs. evil...",Mirror Mirror,2012
211,"[18, 12, 10749]",115290,Two high school students become stranded on a tropical island and must rely on each other for survival. They learn more about themselves and each other while falling in love.,Blue Lagoon: The Awakening,2012
212,"[18, 37]",68718,"With the help of a German bounty hunter, a freed slave sets out to rescue his wife from a brutal Mississippi plantation owner.",Django Unchained,2012
213,"[10751, 16, 35, 12]",82690,"Wreck-It Ralph is the 9-foot-tall, 643-pound villain of an arcade video game named Fix-It Felix Jr., in which the game's titular hero fixes buildings that Ralph destroys. Wanting to prove he can be a good guy and not just a villain, Ralph escapes his game and lands in Hero's Duty, a first-person shooter where he helps the game's hero battle against alien invaders. He later enters Sugar Rush, a kart racing game set on tracks made of candies, cookies and other sweets. There, Ralph meets Vanellope von Schweetz who has learned that her game is faced with a dire threat that could affect the entire arcade, and one that Ralph may have inadvertently started.",Wreck-It Ralph,2012
214,"[878, 12, 9648]",70981,"A team of explorers discover a clue to the origins of mankind on Earth, leading them on a journey to the darkest corners of the universe. There, they must fight a terrifying battle to save the future of the human race.",Prometheus,2012
215,"[35, 18]",112160,Three generations of a French family open up about their sexual experiences and desires after young Romain is caught masturbating in his biology class.,Sexual Chronicles of a French Family,2012
216,"[12, 14, 18]",58595,"After the Evil Queen marries the King, she performs a violent coup in which the King is murdered and his daughter, Snow White, is taken captive. Almost a decade later, a grown Snow White is still in the clutches of the Queen. In order to obtain immortality, The Evil Queen needs the heart of Snow White. After Snow escapes the castle, the Queen sends the Huntsman to find her in the Dark Forest.",Snow White and the Huntsman,2012
217,"[27, 53]",125509,"A small West Virginia town is hosting the legendary Mountain Man Festival on Halloween, where throngs of costumed party goers gather for a wild night of music and mischief. But an inbred family of hillbilly cannibals kill the fun when they trick and treat themselves to a group of visiting college students.",Wrong Turn 5: Bloodlines,2012
218,"[16, 10751, 35]",80321,"Animal pals Alex, Marty, Melman, and Gloria are still trying to make it back to New York's Central Park Zoo. They are forced to take a detour to Europe to find the penguins and chimps who broke the bank at a Monte Carlo casino. When French animal-control officer Capitaine Chantel DuBois picks up their scent, Alex and company are forced to hide out in a traveling circus.",Madagascar 3: Europe's Most Wanted,2012
219,"[12, 14, 18, 10749]",50620,"After the birth of Renesmee, the Cullens gather other vampire clans in order to protect the child from a false allegation that puts the family in front of the Volturi.",The Twilight Saga: Breaking Dawn - Part 2,2012
220,"[28, 12, 53]",76163,"Mr. Church reunites the Expendables for what should be an easy paycheck, but when one of their men is murdered on the job, their quest for revenge puts them deep in enemy territory and up against an unexpected threat.",The Expendables 2,2012
221,"[16, 10751, 14, 12]",75258,Tinkerbell wanders into the forbidden Winter woods and meets Periwinkle. Together they learn the secret of their wings and try to unite the warm fairies and the winter fairies to help Pixie Hollow.,Secret of the Wings,2012
222,"[53, 28, 12, 878]",44833,"When mankind beams a radio signal into space, a reply comes from ‘Planet G’, in the form of several alien crafts that splash down in the waters off Hawaii. Lieutenant Alex Hopper is a weapons officer assigned to the USS John Paul Jones, part of an international naval coalition which becomes the world's last hope for survival as they engage the hostile alien force of unimaginable strength. While taking on the invaders, Hopper must also try to live up to the potential his brother, and his fiancée's father, Admiral Shane, expect of him.",Battleship,2012
223,[35],71552,"The characters we met a little more than a decade ago are returning to East Great Falls for their high-school reunion. In one long-overdue weekend, they will discover what has changed, who hasn’t and that time and distance can’t break the bonds of friendship. It was summer 1999 when four small-town Michigan boys began a quest to lose their virginity. In the years that have passed, Jim and Michelle married while Kevin and Vicky said goodbye. Oz and Heather grew apart, but Finch still longs for Stifler’s mom. Now these lifelong friends have come home as adults to reminisce about – and get inspired by – the hormonal teens who launched a comedy legend.",American Reunion,2012
224,"[36, 18]",82695,"An adaptation of the successful stage musical based on Victor Hugo's classic novel set in 19th-century France, in which a paroled prisoner named Jean Valjean seeks redemption.",Les Misérables,2012
225,"[16, 10751, 14]",81188,"When an evil spirit known as Pitch lays down the gauntlet to take over the world, the immortal Guardians must join forces for the first time to protect the hopes, beliefs and imagination of children all over the world.",Rise of the Guardians,2012
226,"[18, 10749]",151512,"Based on a famous Thai erotic novel, the film tells the story of Jan, a boy who grows up in a house lorded over by his sadistic and debauched father, Luang Wisnan. Set in the 1930′s the story recounts the growing pains of Jan, whose mother dies while giving birth to him and who’s intensely hated by his father. Jan grows up with Aunt Wad, his stepmother, and he struggles to reconcile his guilt and longing with different women in his life, including a girl called Hyacinth, whom he adores, and later Madame Boonleung, his father’s lover who becomes a key to Jan’s sexual awakening.",Jan Dara: The Beginning,2012
227,"[12, 16, 35, 10751]",83201,"Puss in Boots is on a mission to recover the Princess' stolen ruby from the notorious French thief, Whisperer. Reluctantly accompanied by three little kittens, Three Diablos, Puss must tame them before they endanger the mission.",Puss in Boots: The Three Diablos,2012
228,"[35, 14, 53]",127867,"When a couple discovers that a brass teapot makes them money whenever they hurt themselves, they must come to terms with how far they are willing to go.",The Brass Teapot,2012
229,"[16, 27]",133121,"U.S. federal agent Leon S. Kennedy sneaks into the ""East Slavic Republic"" to verify rumors that Bio-Organic Weapons (BOWs) are being used in the country's civil war, which the U.S. and Russia are making preparations to jointly intervene in. Right after his infiltration, the U.S. government orders him to leave immediately. Determined to uncover the truth, Leon ignores the order and enters the battlefield to end the chain of tragedies caused by the BOWs.",Resident Evil: Damnation,2012
230,"[28, 16, 9648]",123025,"Batman has not been seen for ten years. A new breed of criminal ravages Gotham City, forcing 55-year-old Bruce Wayne back into the cape and cowl. But, does he still have what it takes to fight crime in a new era?","Batman: The Dark Knight Returns, Part 1",2012
231,"[35, 10402, 10749]",114150,"College student Beca knows she does not want to be part of a clique, but that's exactly where she finds herself after arriving at her new school. Thrust in among mean gals, nice gals and just plain weird gals, Beca finds that the only thing they have in common is how well they sing together. She takes the women of the group out of their comfort zone of traditional arrangements and into a world of amazing harmonic combinations in a fight to the top of college music competitions.",Pitch Perfect,2012
232,"[35, 14]",62213,Vampire Barnabas Collins is inadvertently freed from his tomb and emerges into the very changed world of 1972. He returns to Collinwood Manor to find that his once-grand estate and family have fallen into ruin.,Dark Shadows,2012
233,"[80, 18, 53]",75780,"When a gunman takes five lives with six shots, all evidence points to the suspect in custody. On interrogation, the suspect offers up a single note: ""Get Jack Reacher!"" So begins an extraordinary chase for the truth, pitting Jack Reacher against an unexpected enemy, with a skill for violence and a secret to keep.",Jack Reacher,2012
234,"[28, 14, 12, 18]",78049,"Since his triumphant rise to power in the original blockbuster ""The Scorpion King"", Mathayus' kingdom has fallen and he's lost his queen to plague. Now an assassin for hire, he must defend a kingdom from an evil tyrant and his ghost warriors for the chance to regain the power and glory he once knew. Starring Ron Perlman (""Hellboy"") and Billy Zane (""Titanic""), and featuring 6-time WWE champion Dave Bautista and UFC star Kimbo Slice, ""The Scorpion King 3: Battle for Redemption"" takes ""The Mummy"" phenomenon to an all-new level of epic action and non-stop adventure.",The Scorpion King 3: Battle for Redemption,2012
235,"[28, 53]",49040,"New CIA operative, Aaron Cross experiences life-or-death stakes that have been triggered by the previous actions of Jason Bourne.",The Bourne Legacy,2012
236,"[878, 12, 14]",70160,"Every year in the ruins of what was once North America, the nation of Panem forces each of its twelve districts to send a teenage boy and girl to compete in the Hunger Games.  Part twisted entertainment, part government intimidation tactic, the Hunger Games are a nationally televised event in which “Tributes” must fight with one another until one survivor remains.  Pitted against highly-trained Tributes who have prepared for these Games their entire lives, Katniss is forced to rely upon her sharp instincts as well as the mentorship of drunken former victor Haymitch Abernathy.  If she’s ever to return home to District 12, Katniss must make impossible choices in the arena that weigh survival against humanity and life against love. The world will be watching.",The Hunger Games,2012
237,"[28, 53, 878]",59967,"In the futuristic action thriller Looper, time travel will be invented but it will be illegal and only available on the black market. When the mob wants to get rid of someone, they will send their target 30 years into the past where a looper, a hired gun, like Joe is waiting to mop up. Joe is getting rich and life is good until the day the mob decides to close the loop, sending back Joe's future self for assassination.",Looper,2012
238,"[28, 12, 878]",49529,"John Carter is a war-weary, former military captain who's inexplicably transported to the mysterious and exotic planet of Barsoom (Mars) and reluctantly becomes embroiled in an epic conflict. It's a world on the brink of collapse, and Carter rediscovers his humanity when he realizes the survival of Barsoom and its people rests in his hands.",John Carter,2012
239,"[14, 12, 28]",57165,"A decade after his heroic defeat of the monstrous Kraken, Perseus-the demigod son of Zeus-is attempting to live a quieter life as a village fisherman and the sole parent to his 10-year old son, Helius. Meanwhile, a struggle for supremacy rages between the gods and the Titans. Dangerously weakened by humanity's lack of devotion, the gods are losing control of the imprisoned Titans and their ferocious leader, Kronos, father of the long-ruling brothers Zeus, Hades and Poseidon.",Wrath of the Titans,2012
240,"[35, 18, 10749]",83666,"Set on an island off the coast of New England in the summer of 1965, Moonrise Kingdom tells the story of two twelve-year-olds who fall in love, make a secret pact, and run away together into the wilderness. As various authorities try to hunt them down, a violent storm is brewing off-shore – and the peaceful island community is turned upside down in more ways than anyone can handle.",Moonrise Kingdom,2012
241,"[28, 14, 27]",72331,"President Lincoln's mother is killed by a supernatural creature, which fuels his passion to crush vampires and their slave-owning helpers.",Abraham Lincoln: Vampire Hunter,2012
242,"[53, 18, 36]",97630,"A chronicle of the decade-long hunt for al-Qaeda terrorist leader Osama bin Laden after the September 2001 attacks, and his death at the hands of the Navy S.E.A.L. Team 6 in May, 2011.",Zero Dark Thirty,2012
243,"[28, 53, 10752]",75674,"When a covert mission to rescue a kidnapped CIA operative uncovers a chilling plot, an elite, highly trained U.S. SEAL team speeds to hotspots around the globe, racing against the clock to stop a deadly terrorist attack.",Act of Valor,2012
244,"[35, 14]",72105,"John Bennett, a man whose childhood wish of bringing his teddy bear to life came true, now must decide between keeping the relationship with the bear or his girlfriend, Lori.",Ted,2012
245,"[18, 53, 80, 9648]",84188,"Sandra is the manager at a fast-food restaurant, and Becky is her teenaged counter girl who really needs the job. One stressful day, a police officer telephones and accuses Becky of stealing money from a customer’s purse, which Becky vehemently denies. Sandra, overwhelmed by her managerial responsibilities, complies with the officer’s orders to detain Becky, beginning a nightmare that tragically blurs the lines between expedience, prudence, legality and reason.",Compliance,2012
246,[18],84892,"15-year-old freshman Charlie is a wallflower, always watching life from the sidelines, until two charismatic senior students become his mentors. Free-spirited Sam and her stepbrother Patrick help Charlie discover the joys of friendship, first love, music and more, while a teacher sparks Charlie's dreams of becoming a writer.",The Perks of Being a Wallflower,2012
247,"[28, 878]",49049,"In the future, America is a dystopian wasteland. The latest scourge is Ma-Ma, a prostitute-turned-drug pusher with a dangerous new drug and aims to take over the city. The only possibility of stopping her is an elite group of urban police called Judges, who combine the duties of judge, jury and executioner to deliver a brutal brand of swift justice. But even the top-ranking Judge, Dredd, discovers that taking down Ma-Ma isn’t as easy as it seems in this explosive adaptation of the hugely popular comic series.",Dredd,2012
248,[35],87584,"A group of college nerds secretly record a washed up celebrity having sex and post the tape on the internet. When the publicity revives the actress's career, every B-list celebrity, reality show reject, and celebutante in Hollywood want to star in the guys next ""production.""",Celebrity Sex Tape,2012
249,[35],87428,"While in his teens, Donny fathered a son, Todd, and raised him as a single parent up until Todd's 18th birthday. Now, after not seeing each other for years, Todd's world comes crashing down when Donny resurfaces just before Todd's wedding.",That's My Boy,2012
250,"[28, 35, 878]",41154,"Agents J (Will Smith) and K (Tommy Lee Jones) are back...in time. J has seen some inexplicable things in his 15 years with the Men in Black, but nothing, not even aliens, perplexes him as much as his wry, reticent partner. But when K's life and the fate of the planet are put at stake, Agent J will have to travel back in time to put things right. J discovers that there are secrets to the universe that K never told him - secrets that will reveal themselves as he teams up with the young Agent K (Josh Brolin) to save his partner, the agency, and the future of humankind.",Men in Black 3,2012
251,"[35, 10751]",82650,"School is out and Greg is ready for the days of summer, when all his plans go wrong. What on earth is he going to do all summer?",Diary of a Wimpy Kid: Dog Days,2012
252,"[16, 35, 28, 10751]",82881,"The kingdom is in a festive mood as everyone gathers for the royal wedding of Rapunzel and Flynn. However, when Pascal and Maximus, as flower chameleon and ring bearer, respectively, lose the gold bands, a frenzied search and recovery mission gets underway. As the desperate duo tries to find the rings before anyone discovers that they’re missing, they leave behind a trail of comical chaos that includes flying lanterns, a flock of doves, a wine barrel barricade and a very sticky finale. Will Maximus and Pascal save the day and make it to the church in time? And will they ever get Flynn’s nose right?",Tangled Ever After,2012
253,[28],97430,"In feudal China, a blacksmith who makes weapons for a small village is put in the position where he must defend himself and his fellow villagers.",The Man with the Iron Fists,2012
254,"[18, 35, 10749]",84199,"Dave, a high school senior, spends most of his time pining away over a girl he can’t have. Aubrey, a junior with artistic aspirations, has a hot boyfriend who doesn’t quite understand her or seem to care. Although they go to different schools, Dave and Aubrey find themselves at the same party. When both head outside to get some air, they meet. A casual conversation sparks an instant connection, and, over the course of a weekend, things turn magical, romantic, complicated, and funny as Aubrey and Dave discover what it's like to fall in love for the first time.",The First Time,2012
255,"[18, 53]",68734,"As the Iranian revolution reaches a boiling point, a CIA 'exfiltration' specialist concocts a risky plan to free six Americans who have found shelter at the home of the Canadian ambassador.",Argo,2012
256,[18],122126,"Set during the early Joseon Dynasty, the film begins with the queen mother and former concubine (Park Ji-young) in a precarious position of having no blood ties to the childless king (Jung Chan). She schemes to replace him on the throne with his stepbrother and her submissive young son Seong-won (Kim Dong-wook). Indifferent to his mother’s plans, the timid prince falls in love at first sight with Hwa-yeon (Jo Yeo-jeong), an aristocrat’s daughter, who has already found love with Kwon-yoo (Kim Min-joon), a commoner. The king is eventually poisoned to death by the queen mother, who is desperate to be in power. Hwa-yeon is moved to a closely watched humble residence, with the queen mother planning to assassinate Hwa-yeon and her son to secure her position in the palace.",The Concubine,2012
257,"[878, 18, 53]",76726,"Three high school students make an incredible discovery, leading to their developing uncanny powers beyond their understanding. As they learn to control their abilities and use them to their advantage, their lives start to spin out of control, and their darker sides begin to take over.",Chronicle,2012
258,"[18, 10751]",119893,A young girl (Jade Pettyjohn) struggles to maintain her school grades while competing as a gymnast.,An American Girl: McKenna Shoots for the Stars,2012
259,"[10749, 878, 18, 14]",58244,"In an alternate universe where twinned worlds have opposite gravities, a young man battles interplanetary prejudice and the laws of physics in his quest to reunite with the long-lost girl of his dreams in this visually stunning romantic adventure that poses the question: what if love was stronger than gravity?",Upside Down,2012
260,"[16, 35, 10751]",62214,"When a car hits young Victor's pet dog Sparky, Victor decides to bring him back to life the only way he knows how. But when the bolt-necked ""monster"" wreaks havoc and terror in the hearts of Victor's neighbors, he has to convince them that Sparky's still the good, loyal friend he was.",Frankenweenie,2012
261,"[28, 12]",98567,"Asian Hawk (Jackie Chan) leads a mercenary team to recover several lost artifacts from the Old Summer Palace, the bronze heads of the 12 Chinese Zodiac animals which were sacked by the French and British armies from the imperial Summer Palace in Beijing in 1860. Assisted by a Chinese student & a Parisian lady, Hawk stops at nothing to accomplish the mission.",Chinese Zodiac,2012
262,"[28, 35, 10749]",59962,Two top CIA operatives wage an epic battle against one another after they discover they are dating the same woman.,This Means War,2012
