,genre_ids,id,overview,title,year
0,"[28, 53, 878, 9648, 12]",27205,"Cobb, a skilled thief who commits corporate espionage by infiltrating the subconscious of his targets is offered a chance to regain his old life as payment for a task considered to be impossible: ""inception"", the implantation of another person's idea into a target's subconscious.",Inception,2010
1,"[18, 53, 9648]",11324,"World War II soldier-turned-U.S. Marshal Teddy Daniels investigates the disappearance of a patient from a hospital for the criminally insane, but his efforts are compromised by his troubling visions and also by a mysterious doctor.",Shutter Island,2010
2,"[12, 14, 10751]",12444,"Harry, Ron and Hermione walk away from their last year at Hogwarts to find and destroy the remaining Horcruxes, putting an end to Voldemort's bid for immortality. But with Harry's beloved Dumbledore dead and Voldemort's unscrupulous Death Eaters on the loose, the world is more dangerous than ever.",Harry Potter and the Deathly Hallows: Part 1,2010
3,"[53, 12, 28]",27578,"Barney Ross leads a band of highly skilled mercenaries including knife enthusiast Lee Christmas, a martial arts expert, heavy weapons specialist, demolitionist, and a loose-cannon sniper. When the group is commissioned by the mysterious Mr. Church to assassinate the dictator of a small South American island, Barney and Lee visit the remote locale to scout out their opposition and discover the true nature of the conflict engulfing the city.",The Expendables,2010
4,"[12, 28, 878]",10138,"With the world now aware of his dual life as the armored superhero Iron Man, billionaire inventor Tony Stark faces pressure from the government, the press and the public to share his technology with the military. Unwilling to let go of his invention, Stark, with Pepper Potts and James 'Rhodey' Rhodes at his side, must forge new alliances – and confront powerful enemies.",Iron Man 2,2010
5,"[12, 14, 10751]",32657,"Accident prone teenager, Percy discovers he's actually a demi-God, the son of Poseidon, and he is needed when Zeus' lightning is stolen. Percy must master his new found skills in order to prevent a war between the Gods that could devastate the entire world.",Percy Jackson & the Olympians: The Lightning Thief,2010
6,"[16, 10751, 35]",10193,"Woody, Buzz, and the rest of Andy's toys haven't been played with in years. With Andy about to go to college, the gang find themselves accidentally left at a nefarious day care center. The toys must band together to escape and return home to Andy.",Toy Story 3,2010
7,"[16, 10751]",38757,"When the kingdom's most wanted-and most charming-bandit Flynn Rider hides out in a mysterious tower, he's taken hostage by Rapunzel, a beautiful and feisty tower-bound teen with 70 feet of magical, golden hair. Flynn's curious captor, who's looking for her ticket out of the tower where she's been locked away for years, strikes a deal with the handsome thief and the unlikely duo sets off on an action-packed escapade, complete with a super-cop horse, an over-protective chameleon and a gruff gang of pub thugs.",Tangled,2010
8,"[10751, 14, 12]",12155,"Alice, an unpretentious and individual 19-year-old, is betrothed to a dunce of an English nobleman. At her engagement party, she escapes the crowd to consider whether to go through with the marriage and falls down a hole in the garden after spotting an unusual rabbit. Arriving in a strange and surreal place called 'Underland,' she finds herself in a world that resembles the nightmares she had as a child, filled with talking animals, villainous queens and knights, and frumious bandersnatches. Alice realizes that she is there for a reason – to conquer the horrific Jabberwocky and restore the rightful queen to her throne.",Alice in Wonderland,2010
9,"[14, 16, 10751]",51739,"14-year-old Arrietty and the rest of the Clock family live in peaceful anonymity as they make their own home from items ""borrowed"" from the house's human inhabitants. However, life changes for the Clocks when a human boy discovers Arrietty.",The Secret World of Arrietty,2010
10,"[16, 10751, 35]",20352,"Villainous Gru lives up to his reputation as a despicable, deplorable and downright unlikable guy when he hatches a plan to steal the moon from the sky. But he has a tough time staying on task after three orphans land in his care.",Despicable Me,2010
11,"[14, 12, 16, 10751]",10191,"As the son of a Viking leader on the cusp of manhood, shy Hiccup Horrendous Haddock III faces a rite of passage: he must kill a dragon to prove his warrior mettle. But after downing a feared dragon, he realizes that he no longer wants to destroy it, and instead befriends the beast – which he names Toothless – much to the chagrin of his warrior father",How to Train Your Dragon,2010
12,"[28, 878, 12, 53]",34851,"A mercenary reluctantly leads a motley crew of warriors who soon come to realize they've been captured and deposited on an alien planet by an unknown nemesis. With the exception of a peculiar physician, they are all cold-blooded killers, convicts, death squad members... hunters who have now become the hunted.",Predators,2010
13,"[18, 53]",44214,"A ballet dancer wins the lead in ""Swan Lake"" and is perfect for the role of the delicate White Swan—Princess Odette—but slowly loses her mind as she becomes more and more like Odile, the Black Swan.",Black Swan,2010
14,"[16, 28, 35, 10751, 878]",38055,"Bumbling supervillain Megamind finally defeats his nemesis, the superhero Metro Man. But without a hero, he loses all purpose and must find new meaning to his life.",Megamind,2010
15,"[27, 80]",41439,"As a deadly battle rages over Jigsaw's brutal legacy, a group of Jigsaw survivors gathers to seek the support of self-help guru and fellow survivor Bobby Dagen, a man whose own dark secrets unleash a new wave of terror.",Saw: The Final Chapter,2010
16,"[12, 14, 28, 10749]",9543,"A rogue prince reluctantly joins forces with a mysterious princess and together, they race against dark forces to safeguard an ancient dagger capable of releasing the Sands of Time – gift from the gods that can reverse time and allow its possessor to rule the world.",Prince of Persia: The Sands of Time,2010
17,"[28, 53]",38234,"Russian inmate Boyka, now severely hobbled by the knee injury suffered at the end of Undisputed 2. No longer the feared prison fighter he was, he has declined so far that he is now good only for cleaning toilets. But when a new prison fight tournament begins - an international affair, matching the best fighters from prisons around the globe, enticing them with the promise of freedom for the winner - Boyka must reclaim his dignity and fight for his position in the tournament.",Undisputed III : Redemption,2010
18,"[80, 27, 53]",73861,"Milos, a retired porn star, leads a normal family life trying to make ends meet. Presented with the opportunity of a lifetime to financially support his family for the rest of their lives, Milos must participate in one last mysterious film. From then on, Milos is drawn into a maelstrom of unbelievable cruelty and mayhem.",A Serbian Film,2010
19,"[28, 53]",44048,"A runaway train, transporting deadly, toxic chemicals, is barreling down on Stanton, Pennsylvania, and only two men can stop it: a veteran engineer and a young conductor. Thousands of lives hang in the balance as these ordinary heroes attempt to chase down one million tons of hurtling steel and prevent an epic disaster.",Unstoppable,2010
20,"[28, 53, 878]",51620,"In the world's most dangerous prison, a new game is born: Death Race. The rules of this adrenaline-fueled blood sport are simple, drive or die. When repentant convict Carl Lucas discovers there's a price on his head, his only hope is to survive a twisted race against an army of hardened criminals and tricked-out cars.",Death Race 2,2010
21,"[12, 14, 28]",18823,"Born of a god but raised as a man, Perseus is helpless to save his family from Hades, vengeful god of the underworld. With nothing to lose, Perseus volunteers to lead a dangerous mission to defeat Hades before he can seize power from Zeus and unleash hell on earth. Battling unholy demons and fearsome beasts, Perseus and his warriors will only survive if Perseus accepts his power as a god, defies fate and creates his own destiny.",Clash of the Titans,2010
22,[27],22894,"When God loses faith in humankind, he sends his legion of angels to bring on the Apocalypse. Humanity's only hope for survival lies in a group of strangers trapped in an out-of-the-way, desert diner with the Archangel Michael.",Legion,2010
23,"[28, 35, 10749]",22538,"Scott Pilgrim is a 23 year old radical Canadian gamer and wannabe rockstar who falls in love with an American delivery girl, Ramona V. Flowers, and must defeat her seven ""evil wannabe superheroes"" to be able to date her.",Scott Pilgrim vs. the World,2010
24,[18],37799,"On a fall night in 2003, Harvard undergrad and computer programming genius Mark Zuckerberg sits down at his computer and heatedly begins working on a new idea. In a fury of blogging and programming, what begins in his dorm room as a small site among friends soon becomes a global social network and a revolution in communication. A mere six years and 500 million friends later, Mark Zuckerberg is the youngest billionaire in history... but for this entrepreneur, success leads to both personal and legal complications.",The Social Network,2010
25,"[27, 53]",49018,"A family discovers that dark spirits have invaded their home after their son inexplicably falls into an endless sleep. When they reach out to a professional for help, they learn things are a lot more personal than they thought.",Insidious,2010
26,"[35, 10751, 14]",23023,"When minor-league hockey player Derek Thompson -- who has a penchant for knocking out his opponents' teeth every time he plays -- disillusions a fan, he is sentenced to a stint for one week as a bona fide, tutu-clad, real-life tooth fairy. Soon, Derek is inspired to rekindle his youthful dreams.",Tooth Fairy,2010
27,"[28, 12, 18, 9648]",48492,An exiled detective is recruited to solve a series of mysterious deaths that threaten to delay the inauguration of Empress Wu.,Detective Dee and the Mystery of the Phantom Flame,2010
28,"[12, 14, 18, 10749]",24021,"Bella once again finds herself surrounded by danger as Seattle is ravaged by a string of mysterious killings and a malicious vampire continues her quest for revenge. In the midst of it all, she is forced to choose between her love for Edward and her friendship with Jacob, knowing that her decision has the potential to ignite the ageless struggle between vampire and werewolf. With her graduation quickly approaching, Bella is confronted with the most important decision of her life.",The Twilight Saga: Eclipse,2010
29,"[9648, 14, 35, 12]",47533,"Scooby-Doo and the gang are on the case when a mysterious lake monster starts scaring the guests at a summer resort in Erie Point, where Fred, Daphne, Velma and Shaggy have taken on seasonal jobs to pay for a barn they accidentally burned down. But in addition to sneaking suspicions, there's some romance in the air.",Scooby-Doo! Curse of the Lake Monster,2010
30,"[28, 12, 18, 10751]",38575,"12-year-old Dre Parker could have been the most popular kid in Detroit, but his mother's latest career move has landed him in China. Dre immediately falls for his classmate Mei Ying but the cultural differences make such a friendship impossible. Even worse, Dre's feelings make him an enemy of the class bully, Cheng. With no friends in a strange land, Dre has nowhere to turn but maintenance man Mr. Han, who is a kung fu master. As Han teaches Dre that kung fu is not about punches and parries, but maturity and calm, Dre realizes that facing down the bullies will be the fight of his life.",The Karate Kid,2010
31,"[16, 12, 10751, 14]",44683,"During a summer stay on the mainland, Tinker Bell is accidentally discovered while investigating a little girl's fairy house. As the other fairies, led by the brash Vidia, launch a daring rescue in the middle of a fierce storm, Tink develops a special bond with the lonely, little girl.",Tinker Bell and the Great Fairy Rescue,2010
32,"[28, 12, 18]",20662,"When soldier Robin happens upon the dying Robert of Loxley, he promises to return the man's sword to his family in Nottingham. There, he assumes Robert's identity; romances his widow, Marion; and draws the ire of the town's sheriff and King John's henchman, Godfrey.",Robin Hood,2010
33,"[28, 80, 53]",26389,"James Reese has a good job as an ambassador's aid in France, but his real passion is a side gig, working in a minor role in the CIA. He would love to be a full-fledged agent and can't believe his luck when he lands an assignment with Charlie Wax. Trigger-happy Charlie soon has James crying for his desk job, but when he learns that the same guys they're trying to catch are after him, James realizes that Charlie may be his only hope of survival.",From Paris with Love,2010
34,"[16, 12, 10751, 14]",41216,"Soren, a young barn owl, is kidnapped by owls of St. Aggie's, ostensibly an orphanage, where owlets are brainwashed into becoming soldiers. He and his new friends escape to the island of Ga'Hoole, to assist its noble, wise owls who fight the army being created by the wicked rulers of St. Aggie's. The film is based on the first three books in the series.",Legend of the Guardians: The Owls of Ga'Hoole,2010
35,"[18, 36]",45269,"The King's Speech tells the story of the man who became King George VI, the father of Queen Elizabeth II. After his brother abdicates, George ('Bertie') reluctantly assumes the throne. Plagued by a dreaded stutter and considered unfit to be king, Bertie engages the help of an unorthodox speech therapist named Lionel Logue. Through a set of unexpected techniques, and as a result of an unlikely friendship, Bertie is able to find his voice and boldly lead the country into war.",The King's Speech,2010
36,"[35, 12, 14, 16, 10751]",10192,"A bored and domesticated Shrek pacts with deal-maker Rumpelstiltskin to get back to feeling like a real ogre again, but when he's duped and sent to a twisted version of Far Far Away—where Rumpelstiltskin is king, ogres are hunted, and he and Fiona have never met—he sets out to restore his world and reclaim his true love.",Shrek Forever After,2010
37,"[28, 35]",37834,"A fugitive couple goes on a glamorous and sometimes deadly adventure where nothing and no one – even themselves – are what they seem. Amid shifting alliances and unexpected betrayals, they race across the globe, with their survival ultimately hinging on the battle of truth vs. trust.",Knight and Day,2010
38,"[53, 28, 12, 35, 80]",34544,"A group of Iraq War veterans goes on the run from U.S. military forces while they try to clear their names after being framed for a crime they didn't commit. Along the way, Col. Hannibal Smith, Capt. H.M. ‘Howling Mad’ Murdock , Sgt. Bosco ‘B.A.’ Baracus, and Lt. Templeton ‘Faceman’ Peck help out various people they encounter.",The A-Team,2010
39,"[12, 10751, 14]",10140,"This time around Edmund and Lucy Pevensie, along with their pesky cousin Eustace Scrubb find themselves swallowed into a painting and on to a fantastic Narnian ship headed for the very edges of the world.",The Chronicles of Narnia: The Voyage of the Dawn Treader,2010
40,"[28, 12, 16]",30061,"A heroic version of Lex Luthor from an alternate universe appears to recruit the Justice League to help save his Earth from the Crime Syndicate, an evil version of the League. What ensues is the ultimate battle of good versus evil in a war that threatens both planets and, through a devious plan launched by Batman's counterpart Owlman, puts the balance of all existence in peril.",Justice League: Crisis on Two Earths,2010
41,"[10749, 878]",59457,"A woman's consuming love forces her to bear the clone of her dead beloved. From his infancy to manhood, she faces the unavoidable complexities of her controversial decision.",Womb,2010
42,"[10770, 16, 14]",47626,"The film follows Hiccup and his young fellows accompanying their mentor, Gobber, on a quest to kill the legendary Boneknapper Dragon. An extra that accompanies the film ""How to Train Your Dragon"".",Legend of the BoneKnapper Dragon,2010
43,[35],37735,"Olive, an average high school student, sees her below-the-radar existence turn around overnight once she decides to use the school's gossip grapevine to advance her social standing. Now her classmates are turning against her and the school board is becoming concerned, including her favorite teacher and the distracted guidance counselor. With the support of her hilariously idiosyncratic parents and a little help from a long-time crush, Olive attempts to take on her notorious new identity and crush the rumor mill once and for all.",Easy A,2010
44,"[35, 10751, 28, 14]",39691,The ongoing war between the canine and feline species is put on hold when they join forces to thwart a rogue cat spy with her own sinister plans for conquest.,Cats & Dogs: The Revenge of Kitty Galore,2010
45,"[12, 28, 878]",20526,"Sam Flynn, the tech-savvy and daring son of Kevin Flynn, investigates his father's disappearance and is pulled into The Grid. With the help of a mysterious program named Quorra, Sam quests to stop evil dictator Clu from crossing into the real world.",TRON: Legacy,2010
46,"[35, 27]",46838,"Two hillbillies are suspected of being killers by a group of paranoid college kids camping near the duo's West Virginian cabin. As the body count climbs, so does the fear and confusion as the college kids try to seek revenge against the pair.",Tucker and Dale vs Evil,2010
47,"[12, 18, 28]",58857,A bravado period action film set at the end of Japan's feudal era in which a group of unemployed samurai are enlisted to bring down a sadistic lord and prevent him from ascending to the throne and plunging the country into a war-torn future.,13 Assassins,2010
48,"[16, 10751]",49953,"A sea turtle who was hatched in 1959 spends the next 50 years traveling the world while it is being changed by global warming. Born on a Baja, California beach in 1959, new hatchling Sammy must do what his fellow newborn sea turtles are doing: race across the beach to the ocean before they are captured by a seagull or crab. Thus begins Sammy's incredible fifty-year ocean journey. Along the way he meets his best friend, a fellow turtle named Ray, and overcomes obstacles both natural and man-made while trying to fulfill his dream of travelling around the world. Throughout his voyage, Sammy never forgets about Shelly - the turtle he saved on his first day and loves passionately from afar. Based on the actual trajectory of a sea turtle's life, the film illustrates the dangers humans pose to the species' survival. The film combines entertainment with an important environmental message.",A Turtle's Tale: Sammy's Adventures,2010
49,"[12, 18, 53]",44115,The true story of mountain climber Aron Ralston's remarkable adventure to save himself after a fallen boulder crashes on his arm and traps him in an isolated canyon in Utah.,127 Hours,2010
50,"[35, 10749]",39451,"It has taken 10 years, two little Fockers with wife Pam and countless hurdles for Greg to finally get in with his tightly wound father-in-law, Jack. After the cash-strapped dad takes a job moonlighting for a drug company, Jack's suspicions about his favorite male nurse come roaring back. When Greg and Pam's entire clan descends for the twins' birthday party, Greg must prove to the skeptical Jack that he's fully capable as the man of the house.",Little Fockers,2010
51,"[35, 27]",43593,"Each year the population of sleepy Lake Victoria, Arizona explodes from 5,000 to 50,000 residents for the annual Spring Break celebration. But then, an earthquake opens an underwater chasm, releasing an enormous swarm of ancient Piranha that have been dormant for thousands of years, now with a taste for human flesh. This year, there's something more to worry about than the usual hangovers and complaints from locals, a new type of terror is about to be cut loose on Lake Victoria.",Piranha 3D,2010
52,"[10749, 35]",25195,"When yet another anniversary passes without a marriage proposal from her boyfriend, Anna decides to take action. Aware of a Celtic tradition that allows women to pop the question on Feb. 29, she plans to follow her lover to Dublin and ask him to marry her. Fate has other plans, however, and Anna winds up on the other side of the Emerald Isle with handsome, but surly, Declan -- an Irishman who may just lead Anna down the road to true love.",Leap Year,2010
53,"[53, 80, 27]",43947,"A remake of the 1979 controversial cult classic, I Spit on Your Grave retells the horrific tale of writer Jennifer Hills who takes a retreat from the city to a charming cabin in the woods to start on her next book. But Jennifer's presence in the small town attracts the attention of a few morally deprived locals led by Johnny, the town's service station owner, his two co-workers, Andy and Stanley, who along with their socially and mentally challenged friend Matthew, set out one night to teach this city girl a lesson.",I Spit on Your Grave,2010
54,"[10402, 10749]",52371,"19-year old Belle practices playing the violin diligently, but is unable to impart her music with a sensitive undertone. Her life changes when she discovers that sexual desire stimulates passion in her music.",LelleBelle,2010
55,"[14, 12, 28, 9648]",35552,"An adventure set in the early part of the 20th century, focused on a popular novelist and her dealings with would-be suitors, the cops, monsters, and other distractions.",The Extraordinary Adventures of Adèle Blanc-Sec,2010
56,"[28, 53, 80]",51608,"His only friend called him 'the man from nowhere'... Taesik, a former special agent becomes a loner after losing his wife in a miserable accident and lives a bitter life running a pawnshop. He only has a few customers and a friend named Somi, a little girl next door. As Taesik spends more and more time with Somi, he gets attached to her. Then Somi is kidnapped by a gang, and as Taesik tries to save Somi by becoming deeply associated with the gang his mysterious past is revealed...",The Man from Nowhere,2010
57,"[27, 9648, 53]",23437,The film that brings back horror icon Freddy Krueger as a darker and more sinister character than ever before. While Freddy is on the prowl a group of teenagers being stalked soon learn they all have a common factor making them targets for this twisted killer.,A Nightmare on Elm Street,2010
58,"[28, 53, 878]",20504,"A post-apocalyptic tale, in which a lone man fights his way across America in order to protect a sacred book that holds the secrets to saving humankind.",The Book of Eli,2010
59,"[14, 12, 28, 35, 18]",27022,"Balthazar Blake is a master sorcerer in modern-day Manhattan trying to defend the city from his arch-nemesis, Maxim Horvath. Balthazar can't do it alone, so he recruits Dave Stutler, a seemingly average guy who demonstrates hidden potential, as his reluctant protégé. The sorcerer gives his unwilling accomplice a crash course in the art and science of magic, and together, these unlikely partners work to stop the forces of darkness.",The Sorcerer's Apprentice,2010
60,[35],38365,"After their high school basketball coach passes away, five good friends and former teammates reunite for a Fourth of July holiday weekend.",Grown Ups,2010
61,"[80, 18, 28, 53]",41283,"Driver (Dwayne Johnson) has spent the last 10 years in prison planning revenge for the murder of his brother. Now that Driver is free to carry out his deadly plan only two men stand in his way- Billy Bob Thornton plays a veteran cop and Oliver Jackson-Cohen, a crazy hitman. With those two close on his trail, Driver races to carry out his mission as the mystery surrounding his brothers murder deepens.",Faster,2010
62,"[28, 80]",23483,"Dave Lizewski is an unnoticed high school student and comic book fan who one day decides to become a super-hero, even though he has no powers, training or meaningful reason to do so.",Kick-Ass,2010
63,"[18, 12, 37]",44264,"Following the murder of her father by hired hand Tom Chaney, 14-year-old farm girl Mattie Ross sets out to capture the killer. To aid her, she hires the toughest U.S. Marshal she can find, a man with ""true grit,"" Reuben J. ""Rooster"" Cogburn. Mattie insists on accompanying Cogburn, whose drinking, sloth, and generally reprobate character do not augment her faith in him. Against his wishes, she joins him in his trek into the Indian Nations in search of Chaney. They are joined by Texas Ranger LaBoeuf, who wants Chaney for his own purposes. The unlikely trio find danger and adventure on the journey, and each has his or her ""grit"" tested.",True Grit,2010
64,"[28, 14]",37034,"Su Qi-Er, a wealthy man living during the Qing Dynasty who loses his fortune and reputation as a result of a conspiracy against him. After being forced out onto the streets, Su dedicates his life to martial arts and reemerges as a patriotic hero known as the ""King of Beggars.""",True Legend,2010
65,"[35, 10751]",33217,"Greg Heffley is headed for big things, but first he has to survive the scariest, most humiliating experience of any kid’s life – middle school! That won’t be easy, considering he’s surrounded by hairy-freckled morons, wedgie-loving bullies and a moldy slice of cheese with nuclear cooties!",Diary of a Wimpy Kid,2010
66,"[9648, 27, 28]",29427,Four friends find themselves trapped in their small hometown after they discover their friends and neighbors going quickly and horrifically insane.,The Crazies,2010
