,genre_ids,id,overview,title,year
550,"[12, 16, 35, 10751]",258509,"Through a series of misunderstandings, Alvin, Simon and Theodore come to believe that Dave is going to propose to his new girlfriend in New York City - and dump them. They have three days to get to him and stop the proposal.",Alvin and the Chipmunks: The Road Chip,2015
551,"[10751, 16, 12, 35]",211672,"Minions Stuart, Kevin and Bob are recruited by Scarlet Overkill, a super-villain who, alongside her inventor husband Herb, hatches a plot to take over the world.",Minions,2015
552,"[27, 53]",243688,"Legendary filmmaker Sam Raimi and director Gil Kenan reimagine and contemporize the classic tale about a family whose suburban home is invaded by angry spirits. When the terrifying apparitions escalate their attacks and take the youngest daughter, the family must come together to rescue her.",Poltergeist,2015
553,"[18, 27, 53]",280092,"A twisted new tale of terror begins for a teenage girl and her family, predating the haunting of the Lambert family in the earlier movies and revealing more mysteries of the otherworldly realm The Further.",Insidious: Chapter 3,2015
554,"[14, 28, 12, 878]",274854,"The modern world holds many secrets, but by far the most astounding is that witches still live among us; vicious supernatural creatures intent on unleashing the Black Death upon the world and putting an end to the human race once and for all. Armies of witch hunters have battled this unnatural enemy for centuries, including Kaulder, a valiant warrior who many years ago slayed the all-powerful Witch Queen, decimating her followers in the process. In the moments right before her death, the Queen cursed Kaulder with immortality, forever separating him from his beloved wife and daughter. Today, Kaulder is the last living hunter who has spent his immortal life tracking down rogue witches, all the while yearning for his long-lost family.",The Last Witch Hunter,2015
555,"[12, 14, 10749]",370964,"In the midst of the wedding princess Miroslava is kidnapped by a dragon and carried away into his castle on the remote island. Mira left everything behind in the past - family, friends and groom. Now the only things she had were a stone cage and a mysterious young man named Arman ... but who is he and what is he doing on that island? Miroslava will know the truth too late: loving a dragon will reveal the bitter truth - love is scary.",He's a Dragon,2015
556,"[28, 12, 16, 14]",303857,"One peaceful day on Earth, two remnants of Frieza's army named Sorbet and Tagoma arrive searching for the Dragon Balls with the aim of reviving Frieza. They succeed, and Frieza subsequently seeks revenge on the Saiyans.",Dragon Ball Z: Resurrection 'F',2015
557,"[18, 53, 36]",314365,"In 2001, editor Marty Baron of The Boston Globe assigns a team of journalists to investigate allegations against John Geoghan, an unfrocked priest accused of molesting more than 80 boys. Led by editor Walter ""Robby"" Robinson, reporters Michael Rezendes, Matt Carroll and Sacha Pfeiffer interview victims and try to unseal sensitive documents. The reporters make it their mission to provide proof of a cover-up of sexual abuse within the Roman Catholic Church.",Spotlight,2015
558,[35],257211,"70-year-old widower Ben Whittaker has discovered that retirement isn't all it's cracked up to be. Seizing an opportunity to get back in the game, he becomes a senior intern at an online fashion site, founded and run by Jules Ostin.",The Intern,2015
559,"[10770, 12, 28, 35, 10751]",277217,"A present-day idyllic kingdom where the benevolent teenage son of King Adam and Queen Belle offers a chance of redemption for the troublemaking offspring of Disney's classic villains: Cruella De Vil (Carlos), Maleficent (Mal), the Evil Queen (Evvie) and Jafar (Jay).",Descendants,2015
560,"[35, 28, 12]",203801,"At the height of the Cold War, a mysterious criminal organization plans to use nuclear weapons and technology to upset the fragile balance of power between the United States and Soviet Union. CIA agent Napoleon Solo and KGB agent Illya Kuryakin are forced to put aside their hostilities and work together to stop the evildoers in their tracks. The duo's only lead is the daughter of a missing German scientist, whom they must find soon to prevent a global catastrophe.",The Man from U.N.C.L.E.,2015
561,"[53, 878, 28, 12]",307663,"Julian Michaels has designed the ultimate resort: VICE, where anything goes and the customers can play out their wildest fantasies with artificial inhabitants who look, think and feel like humans. When an artificial becomes self-aware and escapes, she finds herself caught in the crossfire between Julian's mercenaries and a cop who is hell-bent on shutting down Vice, and stopping the violence once and for all.",Vice,2015
562,"[53, 18]",296098,"During the Cold War, the Soviet Union captures U.S. pilot Francis Gary Powers after shooting down his U-2 spy plane. Sentenced to 10 years in prison, Powers' only hope is New York lawyer James Donovan, recruited by a CIA operative to negotiate his release. Donovan boards a plane to Berlin, hoping to win the young man's freedom through a prisoner exchange. If all goes well, the Russians would get Rudolf Abel, the convicted spy who Donovan defended in court.",Bridge of Spies,2015
563,"[35, 27]",273477,"Three scouts and lifelong friends join forces with one badass cocktail waitress to become the world’s most unlikely team of heroes.  When their peaceful town is ravaged by a zombie invasion, they’ll fight for the badge of a lifetime and put their scouting skills to the test to save mankind from the undead.",Scouts Guide to the Zombie Apocalypse,2015
564,"[12, 35, 16, 10751]",227973,"Snoopy embarks upon his greatest mission as he and his team take to the skies to pursue their arch-nemesis, while his best pal Charlie Brown begins his own epic quest.",The Peanuts Movie,2015
565,"[53, 18]",261023,"The true story of Whitey Bulger, the brother of a state senator and the most infamous violent criminal in the history of South Boston, who became an FBI informant to take down a Mafia family invading his turf.",Black Mass,2015
566,"[80, 53]",181283,"Set in Stalin-era Soviet Union, a disgraced MGB agent is dispatched to investigate a series of child murders -- a case that begins to connect with the very top of party leadership.",Child 44,2015
567,"[53, 18, 12, 28, 36]",205775,"In the winter of 1820, the New England whaling ship Essex was assaulted by something no one could believe: a whale of mammoth size and will, and an almost human sense of vengeance.  The real-life maritime disaster would inspire Herman Melville’s Moby Dick.  But that told only half the story.  “Heart of the Sea” reveals the encounter’s harrowing aftermath, as the ship’s surviving crew is pushed to their limits and forced to do the unthinkable to stay alive.  Braving storms, starvation, panic and despair, the men will call into question their deepest beliefs, from the value of their lives to the morality of their trade, as their captain searches for direction on the open sea and his first mate still seeks to bring the great whale down.",In the Heart of the Sea,2015
568,"[12, 16, 28]",350499,"Ash, Pikachu, and their friends come to a desert city by the sea. Here they meet the Mythical Pokémon Hoopa, which has the ability to summon things—including people and Pokémon—through its magic rings. After a scary incident, they learn of a story about a brave hero who stopped the rampage of a terrifying Pokémon long ago. Now, the threat that has been bottled up for years is in danger of breaking loose again.",Pokémon the Movie: Hoopa and the Clash of Ages,2015
569,"[18, 14, 27, 9648, 10749, 53]",201085,"In the aftermath of a family tragedy, an aspiring author is torn between love for her childhood friend and the temptation of a mysterious outsider. Trying to escape the ghosts of her past, she is swept away to a house that breathes, bleeds… and remembers.",Crimson Peak,2015
570,"[18, 35, 10749]",351964,"Desperate for a good story, a sex-addicted journalist throws himself into the world of high-class escorts when he starts following a Stanford-educated prostitute.",The Escort,2015
571,[35],188222,"Movie star Vincent Chase, together with his boys, Eric, Turtle and Johnny, are back…and back in business with super agent-turned-studio head Ari Gold. Some of their ambitions have changed, but the bond between them remains strong as they navigate the capricious and often cutthroat world of Hollywood.",Entourage,2015
572,"[878, 28, 16, 12]",297556,"After the events of Justice League: War, Ocean Master and Black Manta have declared a war against the surface in retaliation of the aftermath of Apokoliptian-tyrant Darkseid's planetary invasion. Queen Atlanna seeks out her other son, Ocean Master’s half-brother Arthur Curry, a half-human with aquatic powers with no knowledge of his Atlantean heritage, to restore balance.  Living with powers he doesn’t understand and seeing the danger around him, Curry takes steps to embrace his destiny, joining the Justice League, and with his new teammates he battles to save Earth from total destruction.",Justice League: Throne of Atlantis,2015
573,"[28, 12, 10752, 14]",256040,"The young Shivudu is left as a foundling in a small village by his mother. By the time he’s grown up, it has become apparent that he possesses exceptional gifts. He meets the beautiful warrior/princess Avanthika and learns that her queen has been held captive for the last 25 years. Shividu sets off to rescue her, discovering his own origins in the process.",Baahubali: The Beginning,2015
574,"[27, 14, 18, 28, 878]",295830,"100 years ago, titans suddenly appeared on Earth. Soon, human civilization veered on collapse due to the titans. Humans then built a giant wall to defend themselves. Within the giant walls, humans lived in peace, but, 100 years later, the giant wall is broken.",Attack on Titan,2015
575,"[28, 80, 18, 9648, 53]",241554,"Brooklyn mobster and prolific hit man Jimmy Conlon has seen better days. Longtime best friend of a mob boss, Jimmy is haunted by the sins of his past—as well as a dogged police detective who’s been one step behind Jimmy for 30 years. But when Jimmy’s estranged son becomes a target, Jimmy must make a choice between the crime family he chose and the real family he abandoned long ago. Now, with nowhere safe to turn, Jimmy has just one night to figure out exactly where his loyalties lie and to see if he can finally make things right.",Run All Night,2015
576,[35],274167,"The story of a mild-mannered radio executive (Ferrell) who strives to become the best stepdad ever to his wife's two children, but complications ensue when their freewheeling, freeloading real father arrives, forcing stepdad to compete for the affection of the kids.",Daddy's Home,2015
577,"[18, 53]",323372,"Anna Fritz is a beautiful and famous actress. Suddenly her body is found in a hotel and the news of her death goes around the planet. The young, shy caretaker Pau works at the hospital where they carried the body of Anna Fritz. He and his friends  decide to take pictures of the body of Anna Fritz.  They decide they could make love to her and nobody would know. They are in front of Anna Fritz ... and can do with it what  they want.",The Corpse of Anna Fritz,2015
578,"[28, 53]",192141,"In their new overseas home, an American family soon finds themselves caught in the middle of a coup, and they frantically look for a safe escape in an environment where foreigners are being immediately executed.",No Escape,2015
579,"[16, 35, 10751, 12]",382517,"The humans and animals believe a werewolf is on the loose, and former hunter Shaw uses the opportunity to re-open the season. Boog, Elliot, and Mr. Weenie have to face their fears and find the werewolf to get the season closed permanently.",Open Season: Scared Silly,2015
580,"[18, 10402]",277216,"In 1987, five young men, using brutally honest rhymes and hardcore beats, put their frustration and anger about life in the most dangerous place in America into the most powerful weapon they had: their music.  Taking us back to where it all began, Straight Outta Compton tells the true story of how these cultural rebels—armed only with their lyrics, swagger, bravado and raw talent—stood up to the authorities that meant to keep them down and formed the world’s most dangerous group, N.W.A.  And as they spoke the truth that no one had before and exposed life in the hood, their voice ignited a social revolution that is still reverberating today.",Straight Outta Compton,2015
581,"[35, 18]",318846,The men who made millions from a global economic meltdown.,The Big Short,2015
582,"[18, 9648, 10749]",286565,"Quentin Jacobsen has spent a lifetime loving the magnificently adventurous Margo Roth Spiegelman from afar. So when she cracks open a window and climbs back into his life-dressed like a ninja and summoning him for an ingenious campaign of revenge-he follows. After their all-nighter ends and a new day breaks, Q arrives at school to discover that Margo, always an enigma, has now become a mystery. But Q soon learns that there are clues-and they're for him. Urged down a disconnected path, the closer he gets, the less Q sees of the girl he thought he knew.",Paper Towns,2015
583,"[53, 9648, 18]",328425,"A husband and wife try to reinvigorate their relationship but their lives are threatened by a ""friend"" from the husband's past who holds a horrifying secret about him, sending their world into a tailspin.",The Gift,2015
584,[35],252838,"Doug Harris is a loveable but socially awkward groom-to-be with a problem: he has no best man.  With less than two weeks to go until he marries the girl of his dreams, Doug is referred to Jimmy Callahan, owner and CEO of Best Man, Inc., a company that provides flattering best men for socially challenged guys in need.  What ensues is a hilarious wedding charade as they try to pull off the big con, and an unexpected budding bromance between Doug and his fake best man Jimmy.",The Wedding Ringer,2015
585,"[28, 12, 35]",248574,"A 16-year-old international assassin yearning for a ""normal"" adolescence fakes her own death and enrolls as a senior in a suburban high school. She quickly learns that being popular can be more painful than getting water-boarded.",Barely Lethal,2015
586,"[28, 80, 53]",249070,An assassin teams up with a woman to help her find her father and uncover the mysteries of her ancestry.,Hitman: Agent 47,2015
587,"[10749, 35]",272693,"Bianca's universe turns upside down when she learns that her high school refers to her as a ‘DUFF' (Designated Ugly Fat Friend). Hoping to erase that label, she enlists the help of a charming jock and her favorite teacher. Together they'll face the school's mean girl and remind everyone that we are all someone's DUFF… and that's totally fine.",The DUFF,2015
588,[18],312221,"The former World Heavyweight Champion Rocky Balboa serves as a trainer and mentor to Adonis Johnson, the son of his late friend and former rival Apollo Creed.",Creed,2015
589,"[28, 18, 53, 9648]",336882,"Based on the fact that mountain party Åkneset, located in the Geiranger fjord in Norway, one day will race out and create a violent tsunami of over 80 meters that will crush everything in its path before it hits land in Geiranger. A geologist gets caught in the middle of it and a race against time begins.",The Wave,2015
590,"[28, 12]",308504,"When an evil emperor executes their leader, his band of knights – bound by duty and honour – embarks on a journey of vengeance that will not come to an end until they've destroyed their mortal foe.",Last Knights,2015
591,"[28, 35, 14]",334298,Young monster kids try to make peace between the world of humans and the world of the monsters.,Monster Hunt,2015
592,"[18, 53]",263472,"When a devoted husband and father is left home alone for the weekend, two stranded young women unexpectedly knock on his door for help. What starts out as a kind gesture results in a dangerous seduction and a deadly game of cat and mouse.",Knock Knock,2015
593,"[35, 28]",261392,"American Ultra is a fast-paced action comedy about Mike, a seemingly hapless and unmotivated stoner whose small-town life with his live-in girlfriend, Phoebe, is suddenly turned upside down.  Unbeknownst to him, Mike is actually a highly trained, lethal sleeper agent. In the blink of an eye, as his secret past comes back to haunt him, Mike is thrust into the middle of a deadly government operation and is forced to summon his inner action-hero in order to survive.",American Ultra,2015
594,"[878, 28, 27]",342927,"The world’s greatest killing machine is three times as deadly when a mutated shark threatens a cruise ship. As the shark eats its way from one end of the ship to the next, the passengers fight the deadly predator using anything they can find.",3-Headed Shark Attack,2015
595,"[28, 80, 53]",257088,"A young undercover FBI agent infiltrates a gang of thieves who share a common interest in extreme sports. A remake of the 1991 film, ""Point Break"".",Point Break,2015
596,"[53, 28, 80, 9648]",287948,"The fast-paced action movie is again set in the criminal underworld in France, where Frank Martin is known as The Transporter, because he is the best driver and mercenary money can buy. In this installment, he meets Anna and they attempt to take down a group of ruthless Russian human traffickers who also have kidnapped Frank’s father.",The Transporter Refueled,2015
597,"[28, 14, 12]",297291,"When he is betrayed by a trusted friend, Mathayus must marshal all his strength and cunning to outwit a formidable opponent who will stop at nothing to unlock a supreme ancient power.",The Scorpion King: Quest for Power,2015
598,"[14, 18, 10749]",293863,"After 29-year-old Adaline recovers from a nearly lethal accident, she inexplicably stops growing older. As the years stretch on and on, Adaline keeps her secret to herself  until she meets a man who changes her life.",The Age of Adaline,2015
599,[35],296099,"Hoping to bring his family closer together and to recreate his childhood vacation for his own kids, a grown up Rusty Griswold takes his wife and their two sons on a cross-country road trip to the coolest theme park in America, Walley World. Needless to say, things don't go quite as planned.",Vacation,2015
600,"[28, 12, 35]",293660,"Deadpool tells the origin story of former Special Forces operative turned mercenary Wade Wilson, who after being subjected to a rogue experiment that leaves him with accelerated healing powers, adopts the alter ego Deadpool. Armed with his new abilities and a dark, twisted sense of humor, Deadpool hunts down the man who nearly destroyed his life.",Deadpool,2016
601,"[12, 28, 878]",271110,"Following the events of Age of Ultron, the collective governments of the world pass an act designed to regulate all superhuman activity. This polarizes opinion amongst the Avengers, causing two factions to side with Iron Man or Captain America, which causes an epic battle between former allies.",Captain America: Civil War,2016
602,"[28, 12, 14, 878]",284052,"After his career is destroyed, a brilliant but arrogant surgeon gets a new lease on life when a sorcerer takes him under her wing and trains him to defend the world against evil.",Doctor Strange,2016
603,"[16, 12, 10751, 35]",269149,"Determined to prove herself, Officer Judy Hopps, the first bunny on Zootopia's police force, jumps at the chance to crack her first case - even if it means partnering with scam-artist fox Nick Wilde to solve the mystery.",Zootopia,2016
604,"[28, 27, 53]",316727,"Two years after choosing not to kill the man who killed his son, former police sergeant Leo Barnes has become head of security for Senator Charlene Roan, the front runner in the next Presidential election due to her vow to eliminate the Purge. On the night of what should be the final Purge, a betrayal from within the government forces Barnes and Roan out onto the street where they must fight to survive the night.",The Purge: Election Year,2016
605,"[28, 12, 14]",209112,"Fearing the actions of a god-like Super Hero left unchecked, Gotham City’s own formidable, forceful vigilante takes on Metropolis’s most revered, modern-day savior, while the world wrestles with what sort of hero it really needs. And with Batman and Superman at war with one another, a new threat quickly arises, putting mankind in greater danger than it’s ever known before.",Batman v Superman: Dawn of Justice,2016
606,"[12, 10751, 14]",259316,"In 1926, Newt Scamander arrives at the Magical Congress of the United States of America with a magically expanded briefcase, which houses a number of dangerous creatures and their habitats. When the creatures escape from the briefcase, it sends the American wizarding authorities after Newt, and threatens to strain even further the state of magical and non-magical relations.",Fantastic Beasts and Where to Find Them,2016
607,"[28, 12, 878, 14]",246655,"After the re-emergence of the world's first mutant, world-destroyer Apocalypse, the X-Men must unite to defeat his extinction level plan.",X-Men: Apocalypse,2016
608,"[28, 12, 878]",330459,A rogue band of resistance fighters unite for a mission to steal the Death Star plans and bring a new hope to the galaxy.,Rogue One: A Star Wars Story,2016
609,"[12, 18, 10751, 14, 16]",278927,"A man-cub named Mowgli fostered by wolves. After a threat from the tiger Shere Khan, Mowgli is forced to flee the jungle, by which he embarks on a journey of self discovery with the help of the panther, Bagheera and the free-spirited bear, Baloo.",The Jungle Book,2016
610,"[53, 18, 878, 9648]",329865,"Taking place after alien crafts land around the world, an expert linguist is recruited by the military to determine whether they come in peace or are a threat.",Arrival,2016
611,"[18, 36, 10752]",324786,"WWII American Army Medic Desmond T. Doss, who served during the Battle of Okinawa, refuses to kill people and becomes the first Conscientious Objector in American history to receive the Congressional Medal of Honor.",Hacksaw Ridge,2016
612,"[53, 28, 80]",348893,"In the fourth installment of the fighting franchise, Boyka is shooting for the big leagues when an accidental death in the ring makes him question everything he stands for. When he finds out the wife of the man he accidentally killed is in trouble, Boyka offers to fight in a series of impossible battles to free her from a life of servitude",Boyka: Undisputed IV,2016
613,"[28, 12, 878]",188927,"The USS Enterprise crew explores the furthest reaches of uncharted space, where they encounter a mysterious new enemy who puts them and everything the Federation stands for to the test.",Star Trek Beyond,2016
614,"[28, 35, 53]",291805,"One year after outwitting the FBI and winning the public’s adulation with their mind-bending spectacles, the Four Horsemen resurface only to find themselves face to face with a new enemy who enlists them to pull off their most dangerous heist yet.",Now You See Me 2,2016
615,[18],334543,"A five-year-old Indian boy gets lost on the streets of Calcutta, thousands of kilometers from home. He survives many challenges before being adopted by a couple in Australia; 25 years later, he sets out to find his lost family.",Lion,2016
616,"[16, 35, 18, 10751, 10402]",335797,A koala named Buster recruits his best friend to help him drum up business for his theater by hosting a singing competition.,Sing,2016
617,"[35, 18, 10749]",313369,"Mia, an aspiring actress, serves lattes to movie stars in between auditions and Sebastian, a jazz musician, scrapes by playing cocktail party gigs in dingy bars, but as success mounts they are faced with decisions that begin to fray the fragile fabric of their love affair, and the dreams they worked so hard to maintain in each other threaten to rip them apart.",La La Land,2016
618,"[18, 36]",381284,"The untold story of Katherine G. Johnson, Dorothy Vaughan and Mary Jackson – brilliant African-American women working at NASA and serving as the brains behind one of the greatest operations in history – the launch of astronaut John Glenn into orbit. The visionary trio crossed all gender and race lines to inspire generations to dream big.",Hidden Figures,2016
619,"[12, 28, 37]",333484,Seven gun men in the old west gradually come together to help a poor village against savage thieves.,The Magnificent Seven,2016
620,"[9648, 80, 53]",411088,"""The Invisible Guest” turns on a young businessman who wakes up in a hotel room locked from the inside with the dead body of his lover next to him. He hires a prestigious lawyer, and over one night they work together to clarify what happened in a frenetic race against time.",The Invisible Guest,2016
621,"[16, 12, 10751]",313297,"Kubo mesmerizes the people in his village with his magical gift for spinning wild tales with origami. When he accidentally summons an evil spirit seeking vengeance, Kubo is forced to go on a quest to solve the mystery of his fallen samurai father and his mystical weaponry, as well as discover his own magical powers.",Kubo and the Two Strings,2016
622,"[28, 12, 80, 14, 878]",297761,"From DC Comics comes the Suicide Squad, an antihero team of incarcerated supervillains who act as deniable assets for the United States government, undertaking high-risk black ops missions in exchange for commuted prison sentences.",Suicide Squad,2016
623,"[12, 16, 35, 10751]",127380,Dory is reunited with her friends Nemo and Marlin in the search for answers about her past. What can she remember? Who are her parents? And where did she learn to speak Whale?,Finding Dory,2016
