,genre_ids,id,overview,title,year
407,"[28, 12, 14]",122917,"Immediately after the events of The Desolation of Smaug, Bilbo and the dwarves try to defend Erebor's mountain of treasure from others who claim it: the men of the ruined Laketown and the elves of Mirkwood. Meanwhile an army of Orcs led by Azog the Defiler is marching on Erebor, fueled by the rise of the dark lord Sauron. Dwarves, elves and men must unite, and the hope for Middle-Earth falls into Bilbo's hands.",The Hobbit: The Battle of the Five Armies,2014
408,"[28, 53]",245891,Ex-hitman John Wick comes out of retirement to track down the gangsters that took everything from him.,John Wick,2014
409,[18],244786,"Under the direction of a ruthless instructor, a talented young drummer begins to pursue perfection at any cost, even his humanity.",Whiplash,2014
410,"[12, 10751, 16, 28, 35]",177572,"The special bond that develops between plus-sized inflatable robot Baymax, and prodigy Hiro Hamada, who team up with a group of friends to form a band of high-tech heroes.",Big Hero 6,2014
411,"[80, 18, 53]",242582,"When Lou Bloom, desperate for work, muscles into the world of L.A. crime journalism, he blurs the line between observer and participant to become the star of his own story. Aiding him in his effort is Nina, a TV-news veteran.",Nightcrawler,2014
412,"[14, 12, 28, 10751, 10749]",102651,"The untold story of Disney's most iconic villain from the 1959 classic 'Sleeping Beauty'. A beautiful, pure-hearted young woman, Maleficent has an idyllic life growing up in a peaceable forest kingdom, until one day when an invading army threatens the harmony of the land.  Maleficent rises to be the land's fiercest protector, but she ultimately suffers a ruthless betrayal – an act that begins to turn her heart into stone. Bent on revenge, Maleficent faces an epic battle with the invading King's successor and, as a result, places a curse upon his newborn infant Aurora. As the child grows, Maleficent realizes that Aurora holds the key to peace in the kingdom - and to Maleficent's true happiness as well.",Maleficent,2014
413,"[878, 12, 53]",131631,Katniss Everdeen reluctantly becomes the symbol of a mass rebellion against the autocratic Capitol.,The Hunger Games: Mockingjay - Part 1,2014
414,"[18, 35]",194662,"A fading actor best known for his portrayal of a popular superhero attempts to mount a comeback by appearing in a Broadway play. As opening night approaches, his attempts to become more altruistic, rebuild his career, and reconnect with friends and family prove more difficult than expected.",Birdman,2014
415,"[36, 18, 53, 10752]",205596,"Based on the real life story of legendary cryptanalyst Alan Turing, the film portrays the nail-biting race against time by Turing and his brilliant team of code-breakers at Britain's top-secret Government Code and Cypher School at Bletchley Park, during the darkest days of World War II.",The Imitation Game,2014
416,"[28, 12, 14]",102382,"For Peter Parker, life is busy. Between taking out the bad guys as Spider-Man and spending time with the person he loves, Gwen Stacy, high school graduation cannot come quickly enough. Peter has not forgotten about the promise he made to Gwen’s father to protect her by staying away, but that is a promise he cannot keep. Things will change for Peter when a new villain, Electro, emerges, an old friend, Harry Osborn, returns, and Peter uncovers new clues about his past.",The Amazing Spider-Man 2,2014
417,"[12, 35, 14, 10751]",181533,"When the magic powers of The Tablet of Ahkmenrah begin to die out, Larry Daley (Ben Stiller) spans the globe, uniting favorite and new characters while embarking on an epic quest to save the magic before it is gone forever.",Night at the Museum: Secret of the Tomb,2014
418,"[878, 28, 18, 53]",119450,"A group of scientists in San Francisco struggle to stay alive in the aftermath of a plague that is wiping out humanity, while Caesar tries to maintain dominance over his community of intelligent apes.",Dawn of the Planet of the Apes,2014
419,"[27, 53]",270303,"For 19-year-old Jay, fall should be about school, boys and weekends out at the lake. But a seemingly innocent physical encounter turns sour and gives her the inescapable sense that someone, or something, is following her. Faced with this burden, Jay and her teenage friends must find a way to escape the horror that seems to be only a few steps behind.",It Follows,2014
420,"[10751, 16, 12, 35]",270946,"Skipper, Kowalski, Rico and Private join forces with undercover organization The North Wind to stop the villainous Dr. Octavius Brine from destroying the world as we know it.",Penguins of Madagascar,2014
421,"[28, 878]",137113,"Major Bill Cage is an officer who has never seen a day of combat when he is unceremoniously demoted and dropped into combat. Cage is killed within minutes, managing to take an alpha alien down with him. He awakens back at the beginning of the same day and is forced to fight and die again... and again - as physical contact with the alien has thrown him into a time loop.",Edge of Tomorrow,2014
422,"[53, 28, 80]",156022,"In The Equalizer, Denzel Washington plays McCall, a man who believes he has put his mysterious past behind him and dedicated himself to beginning a new, quiet life. But when McCall meets Teri (Chloë Grace Moretz), a young girl under the control of ultra-violent Russian gangsters, he can’t stand idly by – he has to help her. Armed with hidden skills that allow him to serve vengeance against anyone who would brutalize the helpless, McCall comes out of his self-imposed retirement and finds his desire for justice reawakened. If someone has a problem, if the odds are stacked against them, if they have nowhere else to turn, McCall will help. He is The Equalizer.",The Equalizer,2014
423,"[10752, 18, 28]",228150,"Last months of World War II in April 1945. As the Allies make their final push in the European Theater, a battle-hardened U.S. Army sergeant in the 2nd Armored Division named Wardaddy commands a Sherman tank called ""Fury"" and its five-man crew on a deadly mission behind enemy lines. Outnumbered and outgunned, Wardaddy and his men face overwhelming odds in their heroic attempts to strike at the heart of Nazi Germany.",Fury,2014
424,[35],225886,"When Jay and Annie first got together, their romantic connection was intense – but ten years and two kids later, the flame of their love needs a spark.  To kick things up a notch, they decide – why not? – to make a video of themselves trying out every position in The Joy of Sex in one marathon three-hour session.  It seems like a great idea – until they discover that their most private video is no longer private.  With their reputations on the line, they know they’re just one click away from being laid bare to the world... but as their race to reclaim their video leads to a night they'll never forget, they'll find that their video will expose even more than they bargained for.",Sex Tape,2014
425,[53],207933,"A Harvard Medical School graduate takes a position at a mental institution and soon becomes obsessed with a female mental patient, but he has no idea of a recent and horrifying staffing change.",Stonehearst Asylum,2014
426,"[14, 35]",224141,"In a woods filled with magic and fairy tale characters, a baker and his wife set out to end the curse put on them by their neighbor, a spiteful witch.",Into the Woods,2014
427,"[14, 28, 12, 16, 35, 10751]",82702,"The thrilling second chapter of the epic How To Train Your Dragon trilogy brings back the fantastical world of Hiccup and Toothless five years later. While Astrid, Snotlout and the rest of the gang are challenging each other to dragon races (the island's new favorite contact sport), the now inseparable pair journey through the skies, charting unmapped territories and exploring new worlds. When one of their adventures leads to the discovery of a secret ice cave that is home to hundreds of new wild dragons and the mysterious Dragon Rider, the two friends find themselves at the center of a battle to protect the peace.",How to Train Your Dragon 2,2014
428,"[53, 28]",260346,"Ex-government operative Bryan Mills finds his life is shattered when he's falsely accused of a murder that hits close to home. As he's pursued by a savvy police inspector, Mills employs his particular set of skills to track the real killer and exact his unique brand of justice.",Taken 3,2014
429,"[28, 12]",184315,"Fourteen hundred years ago, a tormented soul walked the earth that was neither man nor god. Hercules was the powerful son of the god king Zeus, for this he received nothing but suffering his entire life. After twelve arduous labors and the loss of his family, this dark, world-weary soul turned his back on the gods finding his only solace in bloody battle. Over the years he warmed to the company of six similar souls, their only bond being their love of fighting and presence of death. These men and woman never question where they go to fight or why or whom, just how much they will be paid. Now the King of Thrace has hired these mercenaries to train his men to become the greatest army of all time. It is time for this bunch of lost souls to finally have their eyes opened to how far they have fallen when they must train an army to become as ruthless and blood thirsty as their reputation has become.",Hercules,2014
430,"[878, 28, 12]",91314,"As humanity picks up the pieces, following the conclusion of ""Transformers: Dark of the Moon,"" Autobots and Decepticons have all but vanished from the face of the planet. However, a group of powerful, ingenious businessman and scientists attempt to learn from past Transformer incursions and push the boundaries of technology beyond what they can control - all while an ancient, powerful Transformer menace sets Earth in his cross-hairs.",Transformers: Age of Extinction,2014
431,"[27, 28, 18, 14, 10752]",49017,"Vlad Tepes is a great hero, but when he learns the Sultan is preparing for battle and needs to form an army of 1,000 boys, including Vlad's son, he vows to find a way to protect his family. Vlad turns to dark forces in order to get the power to destroy his enemies and agrees to go from hero to monster as he's turned into the mythological vampire Dracula.",Dracula Untold,2014
432,"[10749, 18]",222935,"Despite the tumor-shrinking medical miracle that has bought her a few years, Hazel has never been anything but terminal, her final chapter inscribed upon diagnosis. But when a patient named Augustus Waters suddenly appears at Cancer Kid Support Group, Hazel's story is about to be completely rewritten.",The Fault in Our Stars,2014
433,"[35, 18]",120467,"The Grand Budapest Hotel tells of a legendary concierge at a famous European hotel between the wars and his friendship with a young employee who becomes his trusted protégé. The story involves the theft and recovery of a priceless Renaissance painting, the battle for an enormous family fortune and the slow and then sudden upheavals that transformed Europe during the first half of the 20th century.",The Grand Budapest Hotel,2014
434,"[80, 53]",189,Some of Sin City's most hard-boiled citizens cross paths with a few of its more reviled inhabitants.,Sin City: A Dame to Kill For,2014
435,"[28, 12, 53]",138103,"Barney, Christmas and the rest of the team comes face-to-face with Conrad Stonebanks, who years ago co-founded The Expendables with Barney. Stonebanks subsequently became a ruthless arms trader and someone who Barney was forced to kill… or so he thought. Stonebanks, who eluded death once before, now is making it his mission to end The Expendables -- but Barney has other plans. Barney decides that he has to fight old blood with new blood, and brings in a new era of Expendables team members, recruiting individuals who are younger, faster and more tech-savvy. The latest mission becomes a clash of classic old-school style versus high-tech expertise in the Expendables’ most personal battle yet.",The Expendables 3,2014
436,[35],227159,"Dale, Kurt and Nick decide to start their own business but things don't go as planned because of a slick investor, prompting the trio to pull off a harebrained and misguided kidnapping scheme.",Horrible Bosses 2,2014
437,"[28, 12, 878]",100402,"After the cataclysmic events in New York with The Avengers, Steve Rogers, aka Captain America is living quietly in Washington, D.C. and trying to adjust to the modern world. But when a S.H.I.E.L.D. colleague comes under attack, Steve becomes embroiled in a web of intrigue that threatens to put the world at risk. Joining forces with the Black Widow, Captain America struggles to expose the ever-widening conspiracy while fighting off professional assassins sent to silence him at every turn. When the full scope of the villainous plot is revealed, Captain America and the Black Widow enlist the help of a new ally, the Falcon. However, they soon find themselves up against an unexpected and formidable enemy—the Winter Soldier.",Captain America: The Winter Soldier,2014
438,"[80, 18, 9648, 53]",169917,Private investigator Matthew Scudder is hired by a drug kingpin to find out who kidnapped and murdered his wife.,A Walk Among the Tombstones,2014
439,"[16, 10751]",175112,"Zarina, a smart and ambitious dust-keeper fairy who’s captivated by Blue Pixie Dust and its endless possibilities, flees Pixie Hollow and joins forces with the scheming pirates of Skull Rock, who make her captain of their ship. Tinker Bell and her friends must embark on an epic adventure to find Zarina, and together they go sword-to-sword with the band of pirates led by a cabin boy named James, who’ll soon be known as Captain Hook himself.",Tinker Bell and the Pirate Fairy,2014
440,"[16, 12, 10751]",82703,"A young boy and his dog, who happens to have a genius-level IQ, spring into action when their time-travel machine is stolen and moments in history begin to be changed.",Mr. Peabody & Sherman,2014
441,"[53, 10749]",255343,"For Pablo Escobar family is everything. When young surfer Nick falls for Escobar's niece, Maria, he finds his life on the line when he's pulled into the dangerous world of the family business.",Escobar: Paradise Lost,2014
442,"[12, 18, 28]",147441,"The defiant leader Moses rises up against the Egyptian Pharaoh Ramses, setting 400,000 slaves on a monumental journey of escape from Egypt and its terrifying cycle of deadly plagues.",Exodus: Gods and Kings,2014
443,"[14, 16, 10751]",265712,"In the suburbs of Tokyo some time ago, there lived a clumsy boy about 10 years old. There appeared in front of him named Sewashi, Nobita's descendant of four generations later from the 22nd century, and Doraemon, a 22nd century cat-type caretaker robot who helps people with its secret gadgets. Sewashi claims that his family is suffering from the debts Nobita made even to his generation, so in order to change this disastrous future, he brought along Doraemon as Nobita's caretaker to bring happiness to his future, although Doraemon is not happy about this. And so Sewashi installed an accomplishment program into Doraemon forcing him to take care of Nobita. Unless he makes Nobita happy, Doraemon can no longer go back to the 22nd century. This is how the life of Doraemon and Nobita begins. Will Doraemon succeed this mission and return to the 22nd century?",Stand by Me Doraemon,2014
444,"[28, 12, 878]",157350,"In a world divided into factions based on personality types, Tris learns that she's been classified as Divergent and won't fit in. When she discovers a plot to destroy Divergents, Tris and the mysterious Four must find out what makes Divergents dangerous before it's too late.",Divergent,2014
445,[35],193893,"It's the ultimate buddy cop movie except for one thing: they're not cops.  When two struggling pals dress as police officers for a costume party, they become neighborhood sensations.  But when these newly-minted “heroes” get tangled in a real life web of mobsters and dirty detectives, they must put their fake badges on the line.",Let's Be Cops,2014
446,[28],289720,"A mysterious warrior teams up with the daughter and son of a deposed Chinese Emperor to defeat their cruel Uncle, who seeks their deaths.",Outcast,2014
447,"[80, 28, 53]",254904,An ex- CIA operative is brought back in on a very personal mission and finds himself pitted against his former pupil in a deadly game involving high level CIA officials and the Russian president-elect.,The November Man,2014
448,"[35, 10749]",277547,"The story of a young man disillusioned by love who meets a breathtaking young woman at a charity dinner by pretending to be a philanthropist. Turns out that she’s engaged to a guy who doesn’t like her going on dates. Challenged by the chase, and egged on by his eclectic friends, he feigns a platonic relationship in order to keep seeing her as he tries to conquer her heart",Playing It Cool,2014
449,[35],262391,A catholic French couple sees their life upside down when their four daughters get married to men of different religion and origins.,Serial (Bad) Weddings,2014
450,"[12, 14]",68737,"John Gregory, who is a seventh son of a seventh son and also the local spook, has protected the country from witches, boggarts, ghouls and all manner of things that go bump in the night. However John is not young anymore, and has been seeking an apprentice to carry on his trade. Most have failed to survive. The last hope is a young farmer's son named Thomas Ward. Will he survive the training to become the spook that so many others couldn't?",Seventh Son,2014
451,"[16, 18]",242828,"Upon being sent to live with relatives in the countryside due to an illness, an emotionally distant adolescent girl becomes obsessed with an abandoned mansion and infatuated with a girl who lives there - a girl who may or may not be real.",When Marnie Was There,2014
452,"[28, 878]",240832,"A woman, accidentally caught in a dark deal, turns the tables on her captors and transforms into a merciless warrior evolved beyond human logic.",Lucy,2014
453,"[28, 18, 53]",137094,"Jack Ryan, as a young covert CIA analyst, uncovers a Russian plot to crash the U.S. economy with a terrorist attack.",Jack Ryan: Shadow Recruit,2014
454,"[878, 53]",206487,"Predestination chronicles the life of a Temporal Agent sent on an intricate series of time-travel journeys designed to prevent future killers from committing their crimes. Now, on his final assignment, the Agent must stop the one criminal that has eluded him throughout time and prevent a devastating attack in which thousands of lives will be lost.",Predestination,2014
455,[35],100042,"20 years after the dimwits set out on their first adventure, they head out in search of one of their long lost children in the hope of gaining a new kidney.",Dumb and Dumber To,2014
456,"[10749, 16, 12, 35, 10751, 14]",228326,"The journey of Manolo, a young man who is torn between fulfilling the expectations of his family and following his heart. Before choosing which path to follow, he embarks on an incredible adventure that spans three fantastical worlds where he must face his greatest fears.",The Book of Life,2014
457,[53],284427,"Benjamin, a young German computer whiz, is invited to join a subversive hacker group that wants to be noticed on the world's stage.",Who Am I,2014
458,"[28, 18, 878]",124905,"Ford Brody, a Navy bomb expert, has just reunited with his family in San Francisco when he is forced to go to Japan to help his estranged father, Joe. Soon, both men are swept up in an escalating crisis when Godzilla, King of the Monsters, arises from the sea to combat malevolent adversaries that threaten the survival of humanity. The creatures leave colossal destruction in their wake, as they make their way toward their final battleground: San Francisco.",Godzilla,2014
459,"[35, 10749]",200727,"Since the moment they met at age 5, Rosie and Alex have been best friends, facing the highs and lows of growing up side by side. A fleeting shared moment, one missed opportunity, and the decisions that follow send their lives in completely different directions. As each navigates the complexities of life, love, and everything in between, they always find their way back to each other - but is it just friendship, or something more?  Based on Cecelia Ahern's bestselling novel, LOVE, ROSIE is a heart-warming, modern comedy-of-errors posing the ultimate question: do we really only get one shot at true love?","Love, Rosie",2014
460,"[12, 16, 10751]",297270,"An ancient myth of a massive creature sparks the curiosity of Tinker Bell and her good friend Fawn, an animal fairy who’s not afraid to break the rules to help an animal in need. But this creature is not welcome in Pixie Hollow — and the scout fairies are determined to capture the mysterious beast, who they fear will destroy their home. Fawn must convince her fairy friends to risk everything to rescue the NeverBeast.",Tinker Bell and the Legend of the NeverBeast,2014
461,[53],72784,"For five men, the opportunity to share a penthouse in the city -- in which to carry on extramarital affairs -- is a dream come true, until the dead body of an unknown woman turns up. Realizing that her killer must be one of their group, the men are gripped by paranoia as each one suspects another. Friendships are tested, loyalties are questioned, and marriages crumble while fear and suspicion run rampant.",The Loft,2014
462,"[28, 10752, 18]",53182,"Based on Frank Miller's latest graphic novel Xerxes and told in the breathtaking visual style of the blockbuster ""300,"" this new chapter of the epic saga takes the action to a fresh battlefield--on the sea--as Greek general Themistokles attempts to unite all of Greece by leading the charge that will change the course of the war. ""300: Rise of an Empire"" pits Themistokles against the massive invading Persian forces led by mortal-turned-god Xerxes and Artemesia, the vengeful commander of the Persian navy.",300: Rise of an Empire,2014
463,"[10752, 28]",190859,"U.S. Navy SEAL Chris Kyle takes his sole mission—protect his comrades—to heart and becomes one of the most lethal snipers in American history. His pinpoint accuracy not only saves countless lives but also makes him a prime target of insurgents. Despite grave danger and his struggle to be a good husband and father to his family back in the States, Kyle serves four tours of duty in Iraq. However, when he finally returns home, he finds that he cannot leave the war behind.",American Sniper,2014
464,"[18, 10749]",261470,"A successful, attractive, intelligent and brilliant advertising executive is longing to finally find emotional stability in his life, and decides to propose to his girlfriend. After she refuses his proposal, his life takes a turn when a new young lady enters his life.",Sorry If I Call You Love,2014
465,"[28, 878]",97020,"In RoboCop, the year is 2028 and multinational conglomerate OmniCorp is at the center of robot technology.  Overseas, their drones have been used by the military for years, but have been forbidden for law enforcement in America.  Now OmniCorp wants to bring their controversial technology to the home front, and they see a golden opportunity to do it.  When Alex Murphy – a loving husband, father and good cop doing his best to stem the tide of crime and corruption in Detroit – is critically injured, OmniCorp sees their chance to build a part-man, part-robot police officer.  OmniCorp envisions a RoboCop in every city and even more billions for their shareholders, but they never counted on one thing: there is still a man inside the machine.",RoboCop,2014
466,"[28, 35]",228967,"Dave Skylark and his producer Aaron Rapoport run the celebrity tabloid show ""Skylark Tonight"". When they land an interview with a surprise fan, North Korean dictator Kim Jong-un, they are recruited by the CIA to turn their trip to Pyongyang into an assassination mission.",The Interview,2014
467,"[18, 12]",86834,A man who suffers visions of an apocalyptic deluge takes measures to protect his family from the coming flood.,Noah,2014
468,"[35, 10749, 80, 18, 9648]",171274,"In Los Angeles at the turn of the 1970s, drug-fueled detective Larry ""Doc"" Sportello investigates the disappearance of an ex-girlfriend.",Inherent Vice,2014
469,"[12, 16, 35, 10751, 14]",137106,"An ordinary Lego mini-figure, mistakenly thought to be the extraordinary MasterBuilder, is recruited to join a quest to stop an evil Lego tyrant from gluing the universe together.",The Lego Movie,2014
470,[18],205587,"A successful lawyer returns to his hometown for his mother's funeral only to discover that his estranged father, the town's judge, is suspected of murder.",The Judge,2014
471,"[53, 28, 878]",218043,A small group of survivors are left behind after millions of people suddenly vanish during the rapture and the world is plunged into chaos and destruction.,Left Behind,2014
472,"[35, 37]",188161,"As a cowardly farmer begins to fall for the mysterious new woman in town, he must put his new-found courage to the test when her husband, a notorious gun-slinger, announces his arrival.",A Million Ways to Die in the West,2014
473,"[28, 35]",168530,"For the past two years, high-school security guard Ben has been trying to show decorated APD detective James that he's more than just a video-game junkie who's unworthy of James' sister, Angela. When Ben finally gets accepted into the academy, he thinks he's earned the seasoned policeman's respect and asks for his blessing to marry Angela. Knowing that a ride along will demonstrate if Ben has what it takes to take care of his sister, James invites him on a shift designed to scare the hell out of the trainee. But when the wild night leads them to the most notorious criminal in the city, James will find that his new partner's rapid-fire mouth is just as dangerous as the bullets speeding at it.",Ride Along,2014
